message,options.0.text,options.0.link,options.1.text,options.1.link,options.2.text,options.2.link
"Hello! My name is Kal. I am not a cousellor, I'm your Kids Help Phone Robot Pal. What's on your mind?",I want help.,How can I help you?,I want to learn.,"What topic do you want to learn about today?
",I want to play!,Can I help you choose a game?
How can I help you?,I want to talk to a counsellor.,Call a counsellor: 1-800-668-6868,I want to write a letter to a trusted adult.,https://kidshelpphone.ca/tool/letter-builder,I want to find a youth program in my area.,https://apps.kidshelpphone.ca/resourcesaroundme/welcome.html
Can I help you choose a game?,Worry Rockets,https://kidshelpphone.ca/tool/worry-rockets,Vent It: Baseball,https://kidshelpphone.ca/game/vent-it-baseball,Vent It: Music,https://kidshelpphone.ca/game/vent-it-music
"What topic do you want to learn about today?
",Bullying,Bullying Topics,Depression,Depression Topics,LGBTQ,LGBTQ Topics
Bullying Topics,Read an article about bullying,https://kidshelpphone.ca/article/what-bullying-0,Watch a video,https://kidshelpphone.ca/,Something else,https://kidshelpphone.ca/
Depresion Topics,Read an article about depresion,https://kidshelpphone.ca/article/living-depression-symptoms-causes-treatments,Watch a video,https://kidshelpphone.ca/,Something else,https://kidshelpphone.ca/
LGBTQ Topics,Read an article about LGBTQ,https://kidshelpphone.ca/search?keys=lgbtq,Watch a viode,https://kidshelpphone.ca/,Something else,https://kidshelpphone.ca/